{"artifact":"ibex_benchmark","schema_version":1,"recorded_at":"2026-07-24T22:46:08Z","environment":{"ruby_engine":"ruby","ruby_version":"4.0.0","ruby_platform":"arm64-darwin24","ibex_version":"0.1.0","host_os":"darwin24","host_cpu":"arm64","processors":12},"configuration":{"grammar":"benchmark/grammars/representative.y","input":"benchmark/grammars/representative.input","seed":12345,"build_iterations":1,"runtime_iterations":100},"measurements":{"generation_ms":4656.157,"runtime_parse_ms":{"plain":1.602,"compact":1.861},"peak_rss_bytes":54214656,"stage_ms":{"parse":10.665,"normalize":1.231,"automaton":4639.183,"table_plain":0.353,"table_compact":4.154,"codegen_plain":1.49,"codegen_compact":5.078}},"structure":{"productions":139,"canonical_intermediate_states":1294,"final_states":250,"tables":{"plain":{"action_cells":2115,"goto_cells":533,"default_cells":250,"total_cells":2898,"bytes":47522},"compact":{"action_cells":5848,"goto_cells":1522,"default_cells":250,"total_cells":7620,"bytes":51999}},"generated_output_bytes":{"plain":63324,"compact":68180}},"digests":{"grammar_source_sha256":"67f98993230a3435c1b1a8b4797d33790b88ba58a0acdd44d68fafb05e8c6344","runtime_input_sha256":"4693d9c773ea2ffab9937afbd557077c2c418fd7c412012ba100bf917f3d5a5a","grammar_ir_sha256":"3611e42cdac9c0e8484d7ea4df68da1665b866a47bd20ca936374aab3fa0b6b6","automaton_ir_sha256":"3c66925c005458da3570043c861eeb0f9478337e1cc25b3793330bde360f598b","plain_tables_sha256":"98c0f2591bf190c3d7ba50fd75e993089f54a5095aee13bc5bf51541655d7505","compact_tables_sha256":"9ec120d70fa135e9d8e96885605e128bb2b1109ca04cbae0106c425892f28e89","plain_output_sha256":"75676f50e550e27d21f01bd3d7bf0b7a2857f92b81c177a8235694774d396b89","compact_output_sha256":"4630cec20a1aea7a435aaf72b8ae558c7c895e057d7db21c29be90360f95569f","runtime_result_sha256":"3fdba35f04dc8c462986c992bcf875546257113072a909c162f7e470e581e278","artifact_sha256":"9ce19ee60fed0e8c24747ba77b05ea052864f854fd33e13956a39a17fa8ee98b"}}
